{
  "contractVersion": "1.0",
  "contractType": "REQUEST",
  "schemaVersion": "1.0.0",
  "meta": {
    "messageId": "msg_01J8Z3K7QF9RCTB2NR9E5THVEA",
    "correlationId": "run_01J8Z3K7QF9RCTB2NR9E5THVEB",
    "causationId": "msg_01J8Z3K7QF9RCTB2NR9E5THVCD",
    "runId": "run_01J8Z3K7QF9RCTB2NR9E5THVEB",
    "nodeId": "nod_01J8Z3K7QF9RCTB2NR9E5THVEC",
    "attempt": 1,
    "createdAt": "2026-09-02T09:20:11.042Z",
    "locale": "en-US",
    "tenantId": "ten_01J8Z3K7QF9RCTB2NR9E5THVAD",
    "channelId": "chn_01J8Z3K7QF9RCTB2NR9E5THVAE",
    "strategyVersion": "1.3.0",
    "producer": {
      "name": "workflow-engine",
      "version": "4.2.1"
    }
  },
  "data": {
    "researchPackage": {
      "topicId": "TOPIC_TAX_SEASON",
      "researchQuestions": [
        {
          "questionId": "QUESTION_CORE_W2_BOXES",
          "questionText": "What does each box on a W-2 actually represent for a first-time filer, and why does Box 1 differ from gross salary?",
          "questionType": "CORE_CLAIM",
          "priority": "HIGH",
          "status": "ANSWERED"
        },
        {
          "questionId": "QUESTION_REFUND_TIMELINE",
          "questionText": "How long does the IRS typically take to issue a refund after e-filing this season?",
          "questionType": "STATISTIC",
          "priority": "HIGH",
          "status": "CONFLICTING"
        },
        {
          "questionId": "QUESTION_BOX12_DEFINITION",
          "questionText": "What does W-2 Box 12 code D mean for a typical salaried filer with an employer retirement plan?",
          "questionType": "DEFINITION",
          "priority": "MEDIUM",
          "status": "PARTIALLY_ANSWERED"
        },
        {
          "questionId": "QUESTION_TIMELINE_CHANGE",
          "questionText": "Has the IRS refund processing timeline changed specifically for the current filing season compared to prior years?",
          "questionType": "RECENT_CHANGE",
          "priority": "LOW",
          "status": "UNANSWERED"
        }
      ],
      "sources": [
        {
          "sourceId": "SOURCE_IRS_W2_GUIDE",
          "title": "About Form W-2, Wage and Tax Statement",
          "publisher": "Internal Revenue Service",
          "url": "https://www.irs.gov/forms-pubs/about-form-w-2",
          "sourceType": "GOVERNMENT",
          "sourceStatus": "FETCHED",
          "language": "en-US",
          "publishedAt": "2025-11-03",
          "lastUpdatedAt": "2026-01-05",
          "accessedAt": "2026-09-02T08:40:00.000Z",
          "derivedFromMaterialId": "MATERIAL_IRS_W2_GUIDE",
          "sourceQuality": {
            "authority": { "score": 1.0, "rationale": "The IRS is the definitive federal authority for the meaning of its own tax form." },
            "relevance": { "score": 0.95, "rationale": "Directly defines Box 1 and Box 2, which is exactly what the core claim question asks." },
            "freshness": { "score": 0.9, "rationale": "Last updated January 2026, within the current filing season." },
            "primarySourceStatus": { "score": 1.0, "rationale": "This is the original party defining the form's own fields." },
            "specificity": { "score": 0.9, "rationale": "States the specific mechanism by which Box 1 differs from gross salary." },
            "corroboration": { "score": 0.4, "rationale": "No second government or standards-body source in the supplied materials independently restates this mechanism." }
          }
        },
        {
          "sourceId": "SOURCE_REUTERS_REFUND",
          "title": "IRS opens 2027 filing season, sets refund expectations",
          "publisher": "Reuters",
          "url": "https://www.reuters.com/markets/us/irs-2027-filing-season-refund-timeline",
          "sourceType": "REPUTABLE_NEWS",
          "sourceStatus": "FETCHED",
          "publishedAt": "2027-01-20",
          "accessedAt": "2026-09-02T08:42:30.000Z",
          "derivedFromMaterialId": "MATERIAL_NEWS_REFUND_DELAY",
          "sourceQuality": {
            "authority": { "score": 0.75, "rationale": "A wire service directly quoting the IRS, though not the IRS itself." },
            "relevance": { "score": 0.9, "rationale": "States the 21-day refund estimate the research question asks about directly." },
            "freshness": { "score": 0.95, "rationale": "Dated within the current filing season the topic addresses." },
            "primarySourceStatus": { "score": 0.5, "rationale": "Reports the IRS's statement rather than being the IRS's own publication." },
            "specificity": { "score": 0.8, "rationale": "Gives a specific day count rather than a vague characterisation." },
            "corroboration": { "score": 0.3, "rationale": "Consistent with general IRS guidance but not independently corroborated by a second source in the supplied materials." }
          }
        },
        {
          "sourceId": "SOURCE_FORUM_BOX12",
          "title": "Refund taking way longer than 21 days this year?",
          "publisher": "personal finance community forum",
          "url": "https://forum.example/threads/refund-taking-way-longer-than-21-days",
          "sourceType": "COMMUNITY_DISCUSSION",
          "sourceStatus": "SEARCH_RESULT_ONLY",
          "accessedAt": "2026-09-02T08:44:10.000Z",
          "derivedFromMaterialId": "MATERIAL_FORUM_W2_CONFUSION",
          "sourceQuality": {
            "authority": { "score": 0.1, "rationale": "Anonymous forum posts carry no institutional backing." },
            "relevance": { "score": 0.6, "rationale": "Directly discusses refund delay, the subject of the timeline question." },
            "freshness": { "score": 0.5, "rationale": "Undated post; only the retrieval date is known." },
            "primarySourceStatus": { "score": 0.2, "rationale": "Individual anecdotal reports, not the IRS or an aggregator of verified cases." },
            "specificity": { "score": 0.3, "rationale": "General complaint without case-specific detail such as credits claimed." },
            "corroboration": { "score": 0.2, "rationale": "Only this one snippet was seen; the underlying thread was not fetched." }
          }
        },
        {
          "sourceId": "SOURCE_ADP_BLOG",
          "title": "Understanding Your W-2",
          "publisher": "ADP",
          "url": "https://www.adp.com/resources/articles-and-insights/articles/w/understanding-your-w2.aspx",
          "sourceType": "COMPANY",
          "sourceStatus": "SEARCH_RESULT_ONLY",
          "accessedAt": "2026-09-02T08:46:00.000Z",
          "derivedFromMaterialId": "MATERIAL_PAYROLL_BLOG",
          "sourceQuality": {
            "authority": { "score": 0.45, "rationale": "A payroll processor has practical expertise but is not the issuing authority for the form." },
            "relevance": { "score": 0.85, "rationale": "Directly addresses the meaning of Box 12 code D." },
            "freshness": { "score": 0.5, "rationale": "No publication date was captured in the supplied snippet." },
            "primarySourceStatus": { "score": 0.2, "rationale": "A secondary explainer, not the IRS's own code definitions." },
            "specificity": { "score": 0.7, "rationale": "Names the specific code and its typical meaning." },
            "corroboration": { "score": 0.15, "rationale": "No IRS or standards-body source in the supplied materials confirms this code definition." }
          }
        }
      ],
      "evidence": [
        {
          "evidenceId": "EVIDENCE_W2_BOX1_WAGES",
          "researchQuestionId": "QUESTION_CORE_W2_BOXES",
          "sourceId": "SOURCE_IRS_W2_GUIDE",
          "claim": "Box 1 reports federal taxable wages, which is lower than gross salary because it excludes certain pre-tax deductions.",
          "evidenceText": {
            "extractionType": "PARAPHRASE",
            "text": "Box 1 shows federal taxable wages, typically lower than gross salary because it excludes pre-tax deductions such as traditional 401(k) contributions and cafeteria plan benefits."
          },
          "supportingContext": "The IRS's own description of what each W-2 box represents, directly from the form's official guidance page.",
          "locationInSource": "Form W-2 box description section",
          "evidenceDate": "2026-01-05",
          "evidenceStrength": "STRONG",
          "relevance": 0.95,
          "freshness": 0.9,
          "verificationStatus": "REQUIRES_VERIFICATION",
          "limitations": [],
          "notesForVerification": "Confirm the specific list of pre-tax deduction types is current for the applicable tax year before treating it as exhaustive."
        },
        {
          "evidenceId": "EVIDENCE_REFUND_21_DAYS",
          "researchQuestionId": "QUESTION_REFUND_TIMELINE",
          "sourceId": "SOURCE_REUTERS_REFUND",
          "claim": "The IRS states that most e-filed refunds with direct deposit are issued within 21 days.",
          "evidenceText": {
            "extractionType": "QUOTATION",
            "text": "most taxpayers who file electronically and choose direct deposit should expect their refund within 21 days of filing"
          },
          "supportingContext": "Reuters reporting the IRS's own stated expectation at the opening of the filing season.",
          "evidenceDate": "2027-01-20",
          "evidenceStrength": "STRONG",
          "relevance": 0.9,
          "freshness": 0.95,
          "verificationStatus": "REQUIRES_VERIFICATION",
          "limitations": ["Reported by a news outlet rather than sourced directly from an IRS publication in the supplied materials."],
          "notesForVerification": "Cross-check against the IRS's own current-season refund guidance page for the exact wording and any caveats on covered credits."
        },
        {
          "evidenceId": "EVIDENCE_REFUND_DELAYS_REPORTED",
          "researchQuestionId": "QUESTION_REFUND_TIMELINE",
          "sourceId": "SOURCE_FORUM_BOX12",